Found ITE IT8613E (id=0x8613, rev=0xc) at 0x2e
Register dump:
idx 20 21 22 23 24 2b
val 86 13 0c 40 00 48
def 86 13 05 40 00 48
LDN 0x01 (COM1)
idx 30 60 61 70 f0
val 01 03 f8 04 01
def 00 03 f8 04 00
LDN 0x04 (Environment controller)
idx 30 60 61 62 63 70 f0 f1  f2 f3 f4 f5 f6 fa fb fc
val 01 0a 30 0a 20 00 00 00  00 00 e0 00 f0 00 00 00
def 00 02 90 02 30 09 00 00  00 00 00 NA NA 00 00 00
LDN 0x05 (Keyboard)
idx 30 60 61 62 63 70 71 f0
val 00 00 60 00 64 01 02 48
def 01 00 60 00 64 01 02 48
LDN 0x06 (Mouse)
idx 30 70 71 f0
val 00 0c 02 00
def 00 0c 02 00
LDN 0x07 (GPIO)
idx 25 26 27 28 29 2a 2c 2d  60 61 62 63 70 71 72 73  74 b0 b1 b2 b3 b4 b8 ba  bb bc bd c0 c1 c2 c3 c4  c8 c9 ca cb cc cd da db  e0 e1 e2 e3 e4 ec f0 f1  f2 f3 f4 f5 f6 f7 f8 f9  fa fb
val 00 f3 00 00 c0 01 41 02  0a 10 0a 00 00 01 20 38  00 00 00 00 00 00 00 00  00 c0 03 01 02 00 40 00  00 02 00 00 00 00 b0 44  00 00 00 00 00 00 00 00  00 00 00 00 0e 00 00 00  00 00
def 00 f3 00 00 00 01 01 00  00 00 00 00 00 00 20 38  00 00 00 00 00 00 00 00  00 00 00 01 00 00 40 00  01 00 00 00 00 00 00 00  00 00 00 00 00 00 00 00  NA NA 00 00 0e 00 00 00  00 00
LDN 0x0a (Consumer IR)
idx 30 60 61 70 f0
val 00 03 10 0b 06
def 00 03 10 0b 06
Environment controller (0x0a35)
LDN 0x00 (BANK0)
idx 00 01 02 03 04 05 06 07  08 09 0a 0b 0c 0e 0f 11  12 13 14 16 17 19 1a 1c  1d 1e 1f 20 21 22 24 25  27 28 29 2a 2b 2c 2d 2e  2f 30 31 32 33 34 35 38  39 3a 3b 40 41 42 43 44
    45 46 47 50 51 52 53 54  55 56 57 58 59 5a 5b 5c  5d 5e 5f 68 69 6a 6b 6c  6d 6e 70 71 72 73 74 75  76 78 79 7a 7b 7c 7d 7e  80 81 82 83 84 85 86 87  88 89 8a 8b 8c 8d 8e 8f 
    90 91 98 99 9c 9d 9e 9f  a0 a1 a2 a3 a4 a5 a6 b4  b5 b6 b7 b8 b9
val 19 90 00 00 ce 37 00 ce  37 c0 64 00 00 4b ff ff  ff 67 c0 80 80 08 ff ff  ff 00 00 72 71 c5 e3 d4  96 8c 15 27 27 27 27 27  99 ff 00 ff 00 ff 00 ff  00 ff 00 7f 80 7f 80 7f 
    80 7f 80 77 03 7f 7f 7f  40 5a 00 90 00 00 ff e0  00 00 00 23 37 50 23 40  04 0f 23 37 50 30 40 00  0f 7f 7f 7f 7f 00 00 0f  00 00 00 00 ff ff ff ff  02 30 01 02 01 6c e0 e0
    00 00 40 00 00 32 00 00  7f 7f 7f 7f 00 00 0f 7f  80 7f 80 9f ea
def 18 00 00 00 00 00 00 00  00 c0 44 00 00 MM MM NA  NA 00 40 00 00 MM MM NA  NA 00 00 MM MM MM MM MM  MM MM MM MM MM MM MM MM  MM NA NA NA NA NA NA NA  NA NA NA NA NA NA NA NA
    NA NA NA 00 00 7f 7f 7f  40 00 00 90 00 00 12 60  00 00 00 7f 7f 7f 00 00  7f 0f 7f 7f 7f 00 00 7f  0f 7f 7f 7f 00 00 7f 0f  MM MM MM MM NA NA NA NA  00 00 00 00 00 00 00 MM
    00 00 00 00 00 NA 00 NA  7f 7f 7f 00 00 7f 0f NA  NA NA NA NA NA
LDN 0x20 (BANK1)
idx c0 c1 c2 d0 d1 d2 d3 d4  d5 d6 d7 d8 d9 da db dc  e0 e1 e2 e3 e4 e5 e6 e7  e8 e9 ea eb ec ed ee ef  f0 f1 f2 f3 f4 f5 f6 f7  f8 f9 fa fb fc fd fe ff
val 00 44 40 00 76 e4 9f ef  50 6b 71 1c 41 d7 f4 4c  49 e0 ee 11 e1 dc 8a f0  18 c0 07 8e 8a d8 56 c6  98 19 5a d9 22 f1 35 0f  21 a5 32 03 61 49 90 c3
def 00 NA NA NA NA NA NA NA  NA NA NA NA NA NA NA NA  NA NA NA NA NA NA NA NA  NA NA NA NA NA NA NA NA  NA NA NA NA NA NA
LDN 0x40 (BANK2)
idx 1d 1e 1f 20 21 22 23 24  25 26 27 28 29 2a 2b 2c  30 31 32 33 34 35 36 37  38 39 3a 3b 3c 3d 40 41  42 43 44 45 46 47 48 49  4a 4b 4c 4d 50 51 52 53  54 55 56 57 58 59 5a 5b  5c 5d 5e 5f 6d 6e 6f 70  71 72 73 74 75 76
val 04 00 00 7f 00 00 00 7f  00 00 00 7f 00 00 00 7f  7f 00 00 00 7f 00 00 00  7f 00 00 00 7f 00 7f 00  00 00 7f 00 00 00 7f 00  00 00 7f 00 7f 00 00 00  7f 00 00 00 7f 00 00 00  7f 3c 3c 3c 3c 3c 3c 4c  4b 00 00 00 00 00
def 00 00 00 NA NA NA NA NA  NA NA NA NA NA NA NA NA  NA NA NA NA NA NA NA NA  NA NA NA NA NA 00 NA NA  NA NA NA NA NA NA NA NA  NA NA NA NA NA NA NA NA  NA NA NA NA NA NA NA NA  NA 00 00 00 00 00 00 NA  NA 00 NA NA NA NA
BRAM (0x0000)
